title,source,datetime,link,type
"Serious $1 Trillion ‘Looming’ Price Crash Warning Issued For Bitcoin, Ethereum And Crypto",Forbes,2023-09-12,https://www.forbes.com/sites/digital-assets/2023/09/12/serious-1-trillion-looming-price-crash-warning-issued-for-bitcoin-ethereum-and-crypto/&ved=2ahUKEwiogpbfuNqBAxWEnGoFHS9EBs04jgIQxfQBegQIABAC&usg=AOvVaw14b7E9ThfCNRiulbxtwKdJ,False
1 Cheap Crypto to Buy Right Now,The Motley Fool,2023-09-12,https://www.fool.com/investing/2023/09/12/1-cheap-crypto-to-buy-right-now/&ved=2ahUKEwiogpbfuNqBAxWEnGoFHS9EBs04jgIQxfQBegQIAxAC&usg=AOvVaw3hLVg7_f-xugTtRtv90Cus,False
"Wash Trading Rampant on Decentralized (DeFi) Crypto Exchanges, Solidus Labs Says",Bloomberg.com,2023-09-12,https://www.bloomberg.com/news/articles/2023-09-12/wash-trading-is-rampant-on-decentralized-crypto-exchanges&ved=2ahUKEwiogpbfuNqBAxWEnGoFHS9EBs04jgIQxfQBegQIBxAC&usg=AOvVaw3Go2xPKkSxiNxmkWZv37FG,False
SEC Chair Gensler calls out crypto's 'wide-ranging noncompliance' in Senate hearing,CNBC,2023-09-12,https://www.cnbc.com/video/2023/09/12/sec-chair-gensler--wide-ranging-noncompliance-senate-hearing-crypto-world.html&ved=2ahUKEwiogpbfuNqBAxWEnGoFHS9EBs04jgIQxfQBegQICBAC&usg=AOvVaw27VfrF2TL8hlbJI86JgIcO,False
Binance US CEO Departs as Crypto Platform Cuts Third of Staff,Bloomberg.com,2023-09-12,https://www.bloomberg.com/news/articles/2023-09-12/binance-us-cuts-100-positions-as-crackdown-erodes-crypto-business&ved=2ahUKEwiogpbfuNqBAxWEnGoFHS9EBs04jgIQxfQBegQIBhAC&usg=AOvVaw2WorFNSahTG9s3w3zq-IRp,False
"Co-founder of $4 billion crypto fraud scheme gets 20 years in prison, 'Cryptoqueen' partner remains at large",CNBC,2023-09-12,https://www.cnbc.com/2023/09/12/cryptoqueen-partner-gets-20-years-prison-in-4-billion-ponzi-fraud.html&ved=2ahUKEwiogpbfuNqBAxWEnGoFHS9EBs04jgIQxfQBegQIBRAC&usg=AOvVaw0ZfI0FFrpbHSxmfNMcnzsh,False
Standard Chartered-owned crypto firm Zodia launches in Singapore,CNBC,2023-09-12,https://www.cnbc.com/2023/09/11/standard-chartered-owned-crypto-firm-zodia-launches-in-singapore.html&ved=2ahUKEwiogpbfuNqBAxWEnGoFHS9EBs04jgIQxfQBegQIBBAC&usg=AOvVaw0o2g1pdEMjlRSO815ygtVx,False
PayPal Introduces On and Off Ramps for Web3 Payments,PayPal Newsroom,2023-09-12,https://newsroom.paypal-corp.com/2023-09-11-PayPal-Introduces-On-and-Off-Ramps-for-Web3-Payments&ved=2ahUKEwit4r_guNqBAxVMkmoFHfQTDTk4mAIQxfQBegQIBhAC&usg=AOvVaw2TrYDcrqOmdEfz_roMsG5s,False
"Joe Biden, China And G20 Leaders Back ‘Swift’ Game-Changing Crypto Price Rules For $1 Trillion Bitcoin, Ethereum, BNB And XRP Market",Forbes,2023-09-12,https://www.forbes.com/sites/digital-assets/2023/09/10/joe-biden-and-g20-nations-endorse-game-changing-radical-global-crypto-price-rules-for-1-trillion-bitcoin-ethereum-bnb-xrp-and-crypto-market/&ved=2ahUKEwit4r_guNqBAxVMkmoFHfQTDTk4mAIQxfQBegQICRAC&usg=AOvVaw1ula6ckYXp7O79Njx4JMic,False
‘Deeply Concerned’—Fed Issues Serious $120 Billion Crypto Warning As Price ‘Death Cross’ Looms For Bitcoin And Ethereum,Forbes,2023-09-12,https://www.forbes.com/sites/digital-assets/2023/09/09/deeply-concerned-fed-issues-serious-120-billion-crypto-warning-as-price-death-cross-looms-for-bitcoin-and-ethereum/&ved=2ahUKEwit4r_guNqBAxVMkmoFHfQTDTk4mAIQxfQBegQIBBAC&usg=AOvVaw3ziTtpWwUawBfh0XMgzIHZ,False
G20 moves forward with international crypto framework,Cointelegraph,2023-09-12,https://cointelegraph.com/news/g20-moves-forward-international-crypto-framework&ved=2ahUKEwit4r_guNqBAxVMkmoFHfQTDTk4mAIQxfQBegQIARAC&usg=AOvVaw1fb4RCEXpPNu66TPhjeLkd,False
"Boss of Failed Crypto Exchange Gets 11,196-Year Sentence",The Wall Street Journal,2023-09-12,https://www.wsj.com/livecoverage/stock-market-today-dow-jones-09-08-2023/card/boss-of-failed-crypto-exchange-gets-11-196-year-sentence-L6ps19yZdDz6SVJnEEWL&ved=2ahUKEwit4r_guNqBAxVMkmoFHfQTDTk4mAIQxfQBegQIAxAC&usg=AOvVaw0c1HGbef0-ReIJU71_Dr9B,False
"It’s Not Just BlackRock. Exchanges Like Nasdaq Are Muscling in on Crypto, Too.",Barron's,2023-09-12,https://www.barrons.com/articles/nasdaq-blackrock-exchanges-crypto-bitcoin-64a3f465&ved=2ahUKEwit4r_guNqBAxVMkmoFHfQTDTk4mAIQxfQBegQIBxAC&usg=AOvVaw30ZflChnKvQ0uxDPlnFN4y,False
Big Questions: What's with all the crypto deaths?,Cointelegraph,2023-09-12,https://cointelegraph.com/magazine/big-questions-crypto-deaths/&ved=2ahUKEwit4r_guNqBAxVMkmoFHfQTDTk4mAIQxfQBegQIAhAC&usg=AOvVaw3UJ_tvtdyhE04u68KlaxjE,False
A New Crypto Scam Shows Perils of Elon Musk's Twitter,CoinDesk,2023-09-12,https://www.coindesk.com/business/2023/09/08/a-new-crypto-scam-shows-perils-of-elon-musks-twitter/&ved=2ahUKEwit4r_guNqBAxVMkmoFHfQTDTk4mAIQxfQBegQICBAC&usg=AOvVaw3lbbiBjRlnbpPyshz4g8c0,True
"Crypto Isn't Dead for Everyone: A Surprising Number of Millennials, Gen X Are Still Invested",Nasdaq,2023-09-12,https://www.nasdaq.com/articles/crypto-isnt-dead-for-everyone%253A-a-surprising-number-of-millennials-gen-x-are-still-invested&ved=2ahUKEwit4r_guNqBAxVMkmoFHfQTDTk4mAIQxfQBegQIBRAC&usg=AOvVaw1wCD2bdddrjYDqODOd54zM,False
"Thodex cryptocurrency boss jailed for 11,196 years in Turkey for fraud",BBC,2023-09-12,https://www.bbc.com/news/world-europe-66752785&ved=2ahUKEwit4r_guNqBAxVMkmoFHfQTDTk4mAIQxfQBegQIABAC&usg=AOvVaw2Jes_SU1tLv5HHk4LlLhEz,False
Venture capital not done with crypto yet,Financial Times,2023-09-12,https://www.ft.com/content/14428c6e-63f8-4868-a85f-2d20f2c7973e&ved=2ahUKEwie9N7huNqBAxXJl2oFHV_vCf84ogIQxfQBegQICRAC&usg=AOvVaw1KNT3HAzPlx1rY0_W6Kcj_,False
"11,196 Years Jail Sentence for Faruk Özer, CEO of Collapsed Turkish Crypto Exchange Thodex",CoinDesk,2023-09-12,https://www.coindesk.com/policy/2023/09/08/11196-years-in-prison-for-faruk-ozer-ceo-of-collapsed-turkish-crypto-exchange-thodex/&ved=2ahUKEwie9N7huNqBAxXJl2oFHV_vCf84ogIQxfQBegQIBRAC&usg=AOvVaw2fAJqugBX0kGtTL528Vvni,False
10 Best Crypto Wallets of September 2023,NerdWallet,2023-09-05,https://www.nerdwallet.com/article/investing/best-bitcoin-cryptocurrency-wallet&ved=2ahUKEwie9N7huNqBAxXJl2oFHV_vCf84ogIQxfQBegQIAhAC&usg=AOvVaw302TdwarEso9am2mur4z0_,False
Big win for Big Crypto,Financial Times,2023-09-05,https://www.ft.com/content/4b416bb0-7cdd-4ce4-a410-114d43376db7&ved=2ahUKEwie9N7huNqBAxXJl2oFHV_vCf84ogIQxfQBegQICBAC&usg=AOvVaw2akUYJzkgsPoKzgY8NO7Vn,False
Why is the crypto market down this week?,Cointelegraph,2023-09-05,https://cointelegraph.com/news/why-is-the-crypto-market-down-this-week&ved=2ahUKEwie9N7huNqBAxXJl2oFHV_vCf84ogIQxfQBegQIBhAC&usg=AOvVaw3o2wtjgwQFT31XZMXQfSHE,False
Why Is The Crypto Market Down In October 2023?,Forbes,2023-09-05,https://www.forbes.com/advisor/in/investing/cryptocurrency/why-crypto-market-is-down/&ved=2ahUKEwie9N7huNqBAxXJl2oFHV_vCf84ogIQxfQBegQIABAC&usg=AOvVaw30Yh_M8G5ccuog1bIT1etD,False
"‘A Huge Deal’—Visa Reveals Crypto Payments Bombshell That Could Cause Bitcoin, Ethereum, BNB, XRP, Cardano, Dogecoin, Solana, Tron And Toncoin Price Chaos",Forbes,2023-09-05,https://www.forbes.com/sites/digital-assets/2023/09/07/a-huge-deal-visa-reveals-crypto-payments-bombshell-that-could-cause-bitcoin-ethereum-bnb-xrp-cardano-dogecoin-solana-tron-and-toncoin-price-chaos/&ved=2ahUKEwie9N7huNqBAxXJl2oFHV_vCf84ogIQxfQBegQIBxAC&usg=AOvVaw1S7TtLovp3lJLQDUAsmSNW,False
"Ozer, Founder of Failed Turkey Crypto Exchange Thodex Gets 11196 Years Prison",Bloomberg.com,2023-09-05,https://www.bloomberg.com/news/articles/2023-09-08/turkish-crypto-boss-sentenced-to-over-11-000-years-in-prison&ved=2ahUKEwie9N7huNqBAxXJl2oFHV_vCf84ogIQxfQBegQIBBAC&usg=AOvVaw0vl8C6QDGPGIvJSWSPWDOo,False
"Blanket Crypto Bans Won’t Work, IMF and FSB Warn in Joint Paper",CoinDesk,2023-09-05,https://www.coindesk.com/policy/2023/09/07/blanket-crypto-bans-wont-work-joint-imf-fsb-paper-warns/&ved=2ahUKEwie9N7huNqBAxXJl2oFHV_vCf84ogIQxfQBegQIAxAC&usg=AOvVaw2AXuXKaqPGUOOcXackZcR-,False
