title,source,datetime,link,type
Is crypto proving to be more of a con than a craze amid scandals?,Yahoo Finance,2023-09-30,https://finance.yahoo.com/video/crypto-proving-more-con-craze-123036265.html&ved=2ahUKEwim3uXTuNqBAxX8m2oFHab-ChE4tAEQxfQBegQIAhAC&usg=AOvVaw0IRjjfqyY-2ozSV3h4WFaj,False
Influential US Crypto Industry Leaders Say SEC Overstepped with Binance Allegations,Bloomberg.com,2023-09-30,https://www.bloomberg.com/news/articles/2023-09-30/us-crypto-industry-leaders-paradigm-circle-say-sec-overstepped-on-binance&ved=2ahUKEwim3uXTuNqBAxX8m2oFHab-ChE4tAEQxfQBegQIABAC&usg=AOvVaw3HDoOGq6xcWnVmKCyWMNlo,False
"Elon Musk And X Could Be About To Decide The Fate Of Bitcoin, Ethereum, XRP And Crypto Amid Wild Price Swings",Forbes,2023-09-30,https://www.forbes.com/sites/digital-assets/2023/09/30/elon-musk-and-x-could-be-about-to-decide-the-fate-of-bitcoin-ethereum-xrp-and-crypto-amid-wild-price-swings/&ved=2ahUKEwim3uXTuNqBAxX8m2oFHab-ChE4tAEQxfQBegQIBBAC&usg=AOvVaw1YSXPTK5QzQwScs5w9bMR1,False
Best Crypto Exchanges UK For October 2023 – Forbes Advisor UK,Forbes,2023-09-30,https://www.forbes.com/uk/advisor/investing/cryptocurrency/best-crypto-exchanges-october-2023/&ved=2ahUKEwim3uXTuNqBAxX8m2oFHab-ChE4tAEQxfQBegQIAxAC&usg=AOvVaw3fbpqcKWjBBkcr4rU2sB4u,False
Crypto hedge fund Three Arrows Capital co-founder arrested at Singapore's Changi Airport,CNA,2023-09-30,https://www.channelnewsasia.com/singapore/three-arrows-capital-co-founder-arrested-changi-airport-jailed-su-zhu-crypto-3810641&ved=2ahUKEwim3uXTuNqBAxX8m2oFHab-ChE4tAEQxfQBegQIBhAC&usg=AOvVaw32xBfJ19SKtt0y2pCGYx92,False
"Singapore Crypto Arrest, India Banknote Deadline, China PMI; Asia Briefing",Bloomberg.com,2023-09-30,https://www.bloomberg.com/news/articles/2023-09-30/singapore-crypto-arrest-india-banknote-deadline-china-pmi-asia-briefing&ved=2ahUKEwim3uXTuNqBAxX8m2oFHab-ChE4tAEQxfQBegQIBxAC&usg=AOvVaw2HqxEoJpqNIXf6VvZiWwB7,False
Three Arrows Founder's Arrest Marks Downfall of Crypto Highflier,Bloomberg.com,2023-09-30,https://www.bloomberg.com/news/articles/2023-09-29/crypto-hedge-fund-3ac-s-su-zhu-arrested-in-singapore-latest-enforcement-action&ved=2ahUKEwim3uXTuNqBAxX8m2oFHab-ChE4tAEQxfQBegQICBAC&usg=AOvVaw35hZn-XOo2KKXVOmI2iGkW,False
"Stearns County Residents Loses Thousands in Online, Crypto Scam",KNSI,2023-09-30,https://knsiradio.com/2023/09/29/stearns-county-residents-loses-thousands-in-online-crypto-scam/&ved=2ahUKEwim3uXTuNqBAxX8m2oFHab-ChE4tAEQxfQBegQIBRAC&usg=AOvVaw2UJPKbmgCRUS8I7tM51Gqr,True
The co-founder of a collapsed crypto hedge fund was arrested in Singapore,The Verge,2023-09-30,https://www.theverge.com/2023/9/29/23896188/crypto-hedge-fund-three-arrows-captial-su-zhu-arrest&ved=2ahUKEwjC3YrVuNqBAxVYmWoFHeeDCkE4vgEQxfQBegQICBAC&usg=AOvVaw0YoBq_GZwx_Crp5b5wkIRs,False
Crypto Biz: Kraken offers stock trading as exchanges adapt to changing regulations,Cointelegraph,2023-09-30,https://cointelegraph.com/news/crypto-biz-kraken-offers-stock-trading-exchanges-adapt-regulations&ved=2ahUKEwjC3YrVuNqBAxVYmWoFHeeDCkE4vgEQxfQBegQICRAC&usg=AOvVaw3T-xsIQBYAzTm2iyRXTeWD,False
Here's what happened in crypto today By Cointelegraph,Investing.com,2023-09-30,https://www.investing.com/news/cryptocurrency-news/heres-what-happened-in-crypto-today-3187531&ved=2ahUKEwjC3YrVuNqBAxVYmWoFHeeDCkE4vgEQxfQBegQIAxAC&usg=AOvVaw0v2S4PGnQFL0vCi54j6ADI,False
A Founder of the Crypto Hedge Fund Three Arrows Capital Is Arrested,The New York Times,2023-09-30,https://www.nytimes.com/2023/09/29/technology/su-zhu-founder-crypto-three-arrows-capital-arrested.html&ved=2ahUKEwjC3YrVuNqBAxVYmWoFHeeDCkE4vgEQxfQBegQIARAC&usg=AOvVaw3tUqSY_4qrGyPDTGn1msTr,False
Bitcoin ETFs: A $600B tipping point for crypto,Cointelegraph,2023-09-29,https://cointelegraph.com/news/bitcoin-etfs-600-billion-tipping-point-crypto&ved=2ahUKEwjC3YrVuNqBAxVYmWoFHeeDCkE4vgEQxfQBegQIBRAC&usg=AOvVaw0H67Vfc2n1kzNMvJgZjeAp,False
Fugitive founder of crypto hedge fund that lost $10 billion arrested in Singapore while attempting to flee,CNBC,2023-09-29,https://www.cnbc.com/2023/09/29/fugitive-founder-of-3ac-crypto-hedge-fund-arrested-in-singapore.html&ved=2ahUKEwjC3YrVuNqBAxVYmWoFHeeDCkE4vgEQxfQBegQIABAC&usg=AOvVaw3nt6JdqvS5NMwiDmHoda6Z,False
Bankrupt crypto hedge fund co-founder Su Zhu arrested,Yahoo Finance,2023-09-29,https://finance.yahoo.com/news/bankrupt-crypto-hedge-fund-co-founder-su-zhu-arrested-162236827.html&ved=2ahUKEwjC3YrVuNqBAxVYmWoFHeeDCkE4vgEQxfQBegQIBxAC&usg=AOvVaw00Fb5Jh3HPZR9wy1IjlDg7,False
Sam Bankman-Fried Trial: Crypto’s First Year After FTX Blowup ‘Miserable',Bloomberg.com,2023-09-29,https://www.bloomberg.com/news/features/2023-09-29/sam-bankman-fried-trial-crypto-s-first-year-after-ftx-blowup-miserable&ved=2ahUKEwjC3YrVuNqBAxVYmWoFHeeDCkE4vgEQxfQBegQIAhAC&usg=AOvVaw3Ch5wkbctOg7XpQW_VvaTl,False
Cofounder of bankrupt crypto hedge fund Three Arrows Capital arrested trying to flee Singapore,Fortune,2023-09-29,https://fortune.com/crypto/2023/09/29/crypto-hedge-fund-three-arrows-capital-cofounder-su-zhu-arrested-singapore/&ved=2ahUKEwjC3YrVuNqBAxVYmWoFHeeDCkE4vgEQxfQBegQIBBAC&usg=AOvVaw23bYY_UDtN_S-Z9ItkAaXp,False
The Best Crypto Wallets of October 2023 – Forbes Advisor,Forbes,2023-09-29,https://www.forbes.com/advisor/investing/cryptocurrency/best-crypto-wallets/&ved=2ahUKEwjC3YrVuNqBAxVYmWoFHeeDCkE4vgEQxfQBegQIBhAC&usg=AOvVaw1qp7_O5I1dAAm7Pb-80Xj8,False
"Napster’s new CEO has a big, crypto-based idea for the next phase of music",Fortune,2023-09-29,https://fortune.com/crypto/2023/09/29/napsters-new-ceo-has-a-big-crypto-based-idea-for-the-next-phase-of-music/&ved=2ahUKEwixk6bWuNqBAxVlk2oFHQXsFqg4yAEQxfQBegQIAhAC&usg=AOvVaw3bbF-l7EZmgaXU0tM6oeWO,False
Su Zhu of Three Arrows Crypto Fund Has Been Arrested,New York Magazine,2023-09-29,https://nymag.com/intelligencer/2023/09/su-zhu-of-three-arrows-crypto-fund-has-been-arrested.html&ved=2ahUKEwixk6bWuNqBAxVlk2oFHQXsFqg4yAEQxfQBegQICRAC&usg=AOvVaw0dOST2cjLaFkTLx_xt9y9o,False
"Bankrupt Crypto Hedge Fund 3AC's Su Zhu Apprehended in Singapore, Liquidator Says",CoinDesk,2023-09-29,https://www.coindesk.com/policy/2023/09/29/bankrupt-crypto-hedge-fund-3acs-su-zhu-apprehended-in-singapore-liquidator-says/&ved=2ahUKEwixk6bWuNqBAxVlk2oFHQXsFqg4yAEQxfQBegQIBxAC&usg=AOvVaw1jbpkP0sQyW5TF9mRSaU0X,False
FTX's $3.4B crypto liquidation: What it means for crypto markets,Cointelegraph,2023-09-29,https://cointelegraph.com/news/ftx-crypto-liquidation-crypto-markets-solana-price&ved=2ahUKEwixk6bWuNqBAxVlk2oFHQXsFqg4yAEQxfQBegQIBRAC&usg=AOvVaw0YPPOt-BfDlgwh4-zz_qoh,False
Gemini to Cease Offering Crypto Services in Netherlands in November,CoinDesk,2023-09-29,https://www.coindesk.com/policy/2023/09/29/gemini-to-cease-offering-crypto-services-in-netherlands-in-november/&ved=2ahUKEwixk6bWuNqBAxVlk2oFHQXsFqg4yAEQxfQBegQIBhAC&usg=AOvVaw1c-SoBEdGwMlkLiNHbv7tT,False
"Coinbase CEO slams JPMorgan for banning crypto payments in UK, suggests government should act",CNBC,2023-09-29,https://www.cnbc.com/2023/09/29/coinbase-ceo-jpmorgan-chase-uk-shouldnt-deplatform-crypto-industry.html&ved=2ahUKEwixk6bWuNqBAxVlk2oFHQXsFqg4yAEQxfQBegQIABAC&usg=AOvVaw26h6XLsmmhGUIuxWBH_aQJ,False
JPEX Crypto Exchange Probe Sees 4 More Arrests: SCMP,CoinDesk,2023-09-29,https://www.coindesk.com/policy/2023/09/29/jpex-crypto-exchange-probe-sees-4-more-arrests-scmp/&ved=2ahUKEwixk6bWuNqBAxVlk2oFHQXsFqg4yAEQxfQBegQICBAC&usg=AOvVaw0N4wCA_hdJnonJyNApMIPb,False
Bitcoin Rises as Crypto Traders Turn Bullish on Government Shutdown,Barron's,2023-09-29,https://www.barrons.com/articles/bitcoin-crypto-markets-today-1b79aa53&ved=2ahUKEwixk6bWuNqBAxVlk2oFHQXsFqg4yAEQxfQBegQIBBAC&usg=AOvVaw3zWPa_qnJV5O03Notme7yf,False
Bankman-Fried trial poses biggest test to date for crypto's top cop,Reuters,2023-09-29,https://www.reuters.com/legal/bankman-fried-trial-poses-biggest-test-date-cryptos-top-cop-2023-09-29/&ved=2ahUKEwixk6bWuNqBAxVlk2oFHQXsFqg4yAEQxfQBegQIAxAC&usg=AOvVaw045tsKIMZbigp5FlhUKgs8,False
Parents of the founder of bankrupt crypto exchange FTX face their own legal troubles,NPR,2023-09-29,https://www.npr.org/2023/09/29/1202582126/parents-of-the-founder-of-bankrupt-crypto-exchange-ftx-face-their-own-legal-trou&ved=2ahUKEwixk6bWuNqBAxVlk2oFHQXsFqg4yAEQxfQBegQIARAC&usg=AOvVaw2QZwM0XH9ANQLQYOWgndw6,False
Coinbase Attempts to Plug Void in Crypto Perpetuals Left by FTX,CoinDesk,2023-09-29,https://www.coindesk.com/business/2023/09/29/coinbase-attempts-to-plug-void-in-crypto-perpetuals-left-by-ftx/&ved=2ahUKEwjhy73XuNqBAxUolGoFHePiDrM40gEQxfQBegQIBxAC&usg=AOvVaw3n70AbW9cP-Wu1t8Sbj2Ia,False
The Metaverse is real: Zuck's 'incredible' photorealistic tech wows crypto Twitter,Cointelegraph,2023-09-29,https://cointelegraph.com/news/metaverse-podcast-lex-fridman-mark-zuckerberg-avatars-meta-codec&ved=2ahUKEwjhy73XuNqBAxUolGoFHePiDrM40gEQxfQBegQICRAC&usg=AOvVaw30M0HcJhc6gE_flyBL0N_F,False
"Exchanges federation touts crypto trading regulation, integration with TradFi",Cointelegraph,2023-09-29,https://cointelegraph.com/news/exchanges-federation-touts-crypto-trading-regulation-integration-tradfi&ved=2ahUKEwjhy73XuNqBAxUolGoFHePiDrM40gEQxfQBegQIBBAC&usg=AOvVaw1lW1N4A_s0hPdsTtMUL2ju,False
Top 10 Cryptocurrencies to Buy and Hold for 10 Years: Evaluating Crypto Predictions,Yahoo Finance,2023-09-29,https://finance.yahoo.com/news/top-10-cryptocurrencies-buy-hold-222447335.html&ved=2ahUKEwjhy73XuNqBAxUolGoFHePiDrM40gEQxfQBegQIARAC&usg=AOvVaw148gGm3uIpwq_NPxuV0dQi,False
U.S. House Bill Seeks Centralized Record of Off-Chain Crypto Transactions,CoinDesk,2023-09-29,https://www.coindesk.com/policy/2023/09/28/us-house-bill-seeks-centralized-record-of-off-chain-crypto-transactions/&ved=2ahUKEwjhy73XuNqBAxUolGoFHePiDrM40gEQxfQBegQICBAC&usg=AOvVaw1tjyT0AkkjU39PvofL7lzp,False
Coinbase CEO joins entrepreneurs on Capitol Hill to push for clear crypto rules: CNBC Crypto World,YouTube,2023-09-29,https://www.youtube.com/watch%3Fv%3DB76G_ri8j_A&ved=2ahUKEwjhy73XuNqBAxUolGoFHePiDrM40gEQxfQBegQIAhAC&usg=AOvVaw3-sY7r-12HkTlmbq_FSLpP,False
Crypto News: What is happening in the World of Cryptocurrency? – Forbes Advisor Australia,Forbes,2023-09-29,https://www.forbes.com/advisor/au/investing/cryptocurrency/crypto-news-australia/&ved=2ahUKEwjhy73XuNqBAxUolGoFHePiDrM40gEQxfQBegQIBRAC&usg=AOvVaw3Dxo4arlDIDfnI9g0Hx1rK,False
Europe’s Crypto Industry Wants Staking Clarity as Regulations Loom,CoinDesk,2023-09-28,https://www.coindesk.com/policy/2023/09/28/europes-crypto-industry-wants-staking-clarity-as-regulations-loom/&ved=2ahUKEwjhy73XuNqBAxUolGoFHePiDrM40gEQxfQBegQIBhAC&usg=AOvVaw28jEQF0SqiCwSdfWBCzj4w,False
Security researcher stopped at US border for investigating crypto scam,Bleeping Computer,2023-09-28,https://www.bleepingcomputer.com/news/security/security-researcher-stopped-at-us-border-for-investigating-crypto-scam/&ved=2ahUKEwjhy73XuNqBAxUolGoFHePiDrM40gEQxfQBegQIABAC&usg=AOvVaw1vM9kva7Kq-IV_22J3qfQy,True
Coinbase Breaks Into Crypto's Biggest Market with Perpetual Futures Approval,Barron's,2023-09-28,https://www.barrons.com/articles/coinbase-perpetual-futures-crypto-retail-7c3b4660&ved=2ahUKEwjhy73XuNqBAxUolGoFHePiDrM40gEQxfQBegQIAxAC&usg=AOvVaw2cX2fII2RyZPxjvcev4910,False
SEC Chair Gensler faces bipartisan backlash over strict crypto regulations,Yahoo Finance,2023-09-28,https://finance.yahoo.com/news/sec-chair-gensler-faces-bipartisan-113000989.html&ved=2ahUKEwjF_-LYuNqBAxUlnGoFHWYrC8443AEQxfQBegQIBBAC&usg=AOvVaw3QxR77Y3ZVW5BMrBA02i3j,False
Europe drives institutional crypto adoption: Blockchain Expo Amsterdam,Cointelegraph,2023-09-28,https://cointelegraph.com/news/europe-institutional-crypto-adoption-blockchain-expo-amsterdam&ved=2ahUKEwjF_-LYuNqBAxUlnGoFHWYrC8443AEQxfQBegQICBAC&usg=AOvVaw2p-ae_FFn6NYIIxR7ptHzN,False
Crypto.com to become preferred exchange for PayPal USD,Cointelegraph,2023-09-28,https://cointelegraph.com/news/crypto-com-preferred-exchange-pay-pal-usd&ved=2ahUKEwjF_-LYuNqBAxUlnGoFHWYrC8443AEQxfQBegQIBhAC&usg=AOvVaw24mrXCcxJDiPHD2LQD48al,False
Brazil's crypto surge prompts central bank to tighten regulation,Cointelegraph,2023-09-28,https://cointelegraph.com/news/crypto-surge-brazil-central-bank-to-tighten-regulation&ved=2ahUKEwjF_-LYuNqBAxUlnGoFHWYrC8443AEQxfQBegQIAhAC&usg=AOvVaw06I_nZ-9VmCKFK6E1czPbX,False
SEC's Gensler taken to task over crypto custody guidance again in House hearing,Cointelegraph,2023-09-28,https://cointelegraph.com/news/sec-gensler-crypto-custody-guidance-house-hearing&ved=2ahUKEwjF_-LYuNqBAxUlnGoFHWYrC8443AEQxfQBegQIBRAC&usg=AOvVaw008NpGQ23gtxvS5lYsB_pU,False
"Minecraft bans Bitcoin P2E, iPhone 15 & crypto gaming, Formula E: Web3 Gamer",Cointelegraph,2023-09-28,https://cointelegraph.com/magazine/minecraft-bans-bitcoin-play-earn-iphone-15-crypto-gaming-formulae-preview-web3-gamer/&ved=2ahUKEwjF_-LYuNqBAxUlnGoFHWYrC8443AEQxfQBegQIABAC&usg=AOvVaw3TUIDXhYF5v2tRMFBp2f2T,False
SEC’s Gensler Throws More Crypto Punches in Congressional Hearing,CoinDesk,2023-09-28,https://www.coindesk.com/policy/2023/09/27/secs-gensler-throws-more-crypto-punches-in-congressional-hearing/&ved=2ahUKEwjF_-LYuNqBAxUlnGoFHWYrC8443AEQxfQBegQIBxAC&usg=AOvVaw2J8IU5sqojYE_cfzfKYxSA,False
"US crypto industry comes to Washington, but faces uphill struggle",Reuters,2023-09-28,https://www.reuters.com/business/finance/us-crypto-industry-comes-washington-faces-uphill-struggle-2023-09-27/&ved=2ahUKEwjF_-LYuNqBAxUlnGoFHWYrC8443AEQxfQBegQIAxAC&usg=AOvVaw3DsINE7xBJFrt4XYRmoCTE,False
Coinbase CEO: The U.S. is lagging behind in crypto regulation,YouTube,2023-09-28,https://www.youtube.com/watch%3Fv%3Dkg5ZR98E9_o&ved=2ahUKEwjF_-LYuNqBAxUlnGoFHWYrC8443AEQxfQBegQICRAC&usg=AOvVaw3ChT2u9D-Smgrfu9D45DtT,False
Crypto Exchange Kraken to Explore Stock Trading: Bloomberg,CoinDesk,2023-09-28,https://www.coindesk.com/business/2023/09/27/crypto-exchange-kraken-to-explore-stock-trading-bloomberg/&ved=2ahUKEwjF_-LYuNqBAxUlnGoFHWYrC8443AEQxfQBegQIARAC&usg=AOvVaw0UkIgHq7gSqahQim0lVbuF,False
How AI is changing crypto: Hype vs. reality,Cointelegraph,2023-09-28,https://cointelegraph.com/news/how-ai-changing-crypto-hype-reality&ved=2ahUKEwjN-ILauNqBAxU7kmoFHQzcAR045gEQxfQBegQICBAC&usg=AOvVaw29NCmjJvFp1J8wvxs3MxdI,False
"Crypto exchange Kraken to offer US-listed stocks' trading, Bloomberg reports",Reuters,2023-09-28,https://www.reuters.com/markets/currencies/crypto-exchange-kraken-offer-us-listed-stocks-trading-bloomberg-news-2023-09-27/&ved=2ahUKEwjN-ILauNqBAxU7kmoFHQzcAR045gEQxfQBegQICRAC&usg=AOvVaw087lkEjRp4axFTOcIaJqZM,False
‘Alarm Bells For Crypto’—Leak Reveals Joe Biden Could Be About To Issue a Game-Changing Executive Order And Trigger Bitcoin Price Chaos,Forbes,2023-09-27,https://www.forbes.com/sites/digital-assets/2023/09/27/alarm-bells-for-crypto-leak-reveals-joe-biden-could-be-about-to-issue-a-game-changing-executive-order-and-trigger-bitcoin-price-chaos/&ved=2ahUKEwjN-ILauNqBAxU7kmoFHQzcAR045gEQxfQBegQIBhAC&usg=AOvVaw2bQxbMurrdfchhPGJGsJTz,False
Crypto Scam Led to Demise of Heartland Tri-State Bank,Bloomberg.com,2023-09-27,https://www.bloomberg.com/news/articles/2023-09-27/crypto-scam-led-to-demise-of-heartland-tri-state-bank&ved=2ahUKEwjN-ILauNqBAxU7kmoFHQzcAR045gEQxfQBegQIBBAC&usg=AOvVaw1F-18QXti6hRhmPesrGhD_,True
Binance to Exit Russia With Sale to Crypto Exchange CommEX,The Wall Street Journal,2023-09-27,https://www.wsj.com/finance/currencies/binance-to-exit-russia-with-sale-to-crypto-exchange-commex-1b42bb16&ved=2ahUKEwjN-ILauNqBAxU7kmoFHQzcAR045gEQxfQBegQIABAC&usg=AOvVaw3mI0_MrXsoYp55EGDXWbqd,False
FTX Chief Once Met With Powell. Now D.C. Crypto Lobbyists Are Struggling.,The New York Times,2023-09-27,https://www.nytimes.com/2023/09/27/business/economy/crypto-lobbying-washington-ftx.html&ved=2ahUKEwjN-ILauNqBAxU7kmoFHQzcAR045gEQxfQBegQIAhAC&usg=AOvVaw1oAloMYBrSo40AhijcrKL3,False
12 Most Popular Types Of Cryptocurrency,Bankrate,2023-09-27,https://www.bankrate.com/investing/types-of-cryptocurrency/&ved=2ahUKEwjN-ILauNqBAxU7kmoFHQzcAR045gEQxfQBegQIARAC&usg=AOvVaw3lNVrJGUgVfF729b8eMP9Z,False
Crypto market cap 2010-2023,Statista,2023-09-27,https://www.statista.com/statistics/730876/cryptocurrency-maket-value/&ved=2ahUKEwjN-ILauNqBAxU7kmoFHQzcAR045gEQxfQBegQIBRAC&usg=AOvVaw2cc0ICNOON3e2OqJanUeAH,False
"Fed report blames Silvergate collapse on crypto coziness, nepotism",Blockworks,2023-09-27,https://blockworks.co/news/federal-reserve-board-report-silvergate-collapse&ved=2ahUKEwjN-ILauNqBAxU7kmoFHQzcAR045gEQxfQBegQIAxAC&usg=AOvVaw0XcXsOn0wcSCCXxYruaokY,False
Idris Elba Is Ready to Talk About Crypto,WIRED,2023-09-27,https://www.wired.com/story/idris-elba-crypto-stellar-development-foundation/&ved=2ahUKEwjN-ILauNqBAxU7kmoFHQzcAR045gEQxfQBegQIBxAC&usg=AOvVaw1G635VN2hUsMf3PpaCzJYx,False
Crypto lender BlockFi gets court nod for plan to repay customers,Cointelegraph,2023-09-27,https://cointelegraph.com/news/crypto-lender-block-fi-liquidation-plan-approval-repay-customer&ved=2ahUKEwic3aHbuNqBAxUrkmoFHV8QBEw48AEQxfQBegQICBAC&usg=AOvVaw3K60QyvEOsFzC7lx9iEQu4,False
Chase UK will soon bar its customers from making crypto transactions due to an uptick in scams,AP News,2023-09-27,https://apnews.com/article/chase-uk-bans-cryptocurreny-transactions-c03b555641f2c0af6ccbc03d142e0a1c&ved=2ahUKEwic3aHbuNqBAxUrkmoFHV8QBEw48AEQxfQBegQICRAC&usg=AOvVaw3lPUzSwLXb1XnwP6eCdSl_,True
JPMorgan’s Chase UK bank to block crypto transactions over scam fears: CNBC Crypto World,YouTube,2023-09-27,https://www.youtube.com/watch%3Fv%3DyNusdD36gMs&ved=2ahUKEwic3aHbuNqBAxUrkmoFHV8QBEw48AEQxfQBegQIABAC&usg=AOvVaw0xOAKArmFFLXw0rOB944bI,True
How Staking Rates Can Drive the Crypto Economy Forward,CoinDesk,2023-09-27,https://www.coindesk.com/consensus-magazine/2023/09/26/how-staking-rates-can-drive-the-crypto-economy-forward/&ved=2ahUKEwic3aHbuNqBAxUrkmoFHV8QBEw48AEQxfQBegQIBxAC&usg=AOvVaw3c65hmjUQyd6n0hKF1QV3B,False
"The crypto industry is not dead yet. BlackRock is about to revive it, says Bernstein",CNBC,2023-09-27,https://www.cnbc.com/2023/09/26/blackrock-is-about-to-revive-the-crypto-industry-bernstein-says.html&ved=2ahUKEwic3aHbuNqBAxUrkmoFHV8QBEw48AEQxfQBegQIAhAC&usg=AOvVaw2zznNi81QCBa6JNuQ1mC5q,False
JPMorgan's UK digital bank blocks customers from buying crypto,CNBC,2023-09-26,https://www.cnbc.com/2023/09/26/jpmorgans-uk-digital-bank-blocks-customers-from-buying-crypto.html&ved=2ahUKEwic3aHbuNqBAxUrkmoFHV8QBEw48AEQxfQBegQIBhAC&usg=AOvVaw0wK_tgKvE7DaeywQ8U_dI_,False
JPMorgan's UK bank Chase to ban crypto transactions,Reuters,2023-09-26,https://www.reuters.com/technology/jpmorgans-uk-bank-chase-ban-crypto-transactions-2023-09-26/&ved=2ahUKEwic3aHbuNqBAxUrkmoFHV8QBEw48AEQxfQBegQIBBAC&usg=AOvVaw1LQr8HgLvHeNUnTOzIvBeE,False
"Chase U.K. to Block Crypto Payments Citing Fraud, Scams",CoinDesk,2023-09-26,https://www.coindesk.com/policy/2023/09/26/chase-uk-to-block-crypto-payments-citing-fraud-scams/&ved=2ahUKEwic3aHbuNqBAxUrkmoFHV8QBEw48AEQxfQBegQIARAC&usg=AOvVaw36TVc_DxOvezKsEXQcdfvo,True
"Binance, the World's Biggest Crypto Firm, Is Melting Down - WSJ",The Wall Street Journal,2023-09-26,https://www.wsj.com/finance/currencies/the-worlds-biggest-crypto-firm-is-melting-down-338b8e17&ved=2ahUKEwic3aHbuNqBAxUrkmoFHV8QBEw48AEQxfQBegQIAxAC&usg=AOvVaw0XXQJ0ZXWkvZ-2D4wjHBOw,False
MoneyGram unveils non-custodial wallet to bridge the worlds of crypto and fiat currency with USDC,Fortune,2023-09-26,https://fortune.com/crypto/2023/09/26/moneygram-noncustodial-wallet-usdc-stellar-crypto-remittances/&ved=2ahUKEwic3aHbuNqBAxUrkmoFHV8QBEw48AEQxfQBegQIBRAC&usg=AOvVaw3PD6DIIvqCPrGA7AyM-esC,False
Crypto exchange Binance reopens exchange services in Belgium,Cointelegraph,2023-09-26,https://cointelegraph.com/news/crypto-exchange-binance-resumes-services-belgium&ved=2ahUKEwiaysTcuNqBAxWkmWoFHXsgBTk4-gEQxfQBegQIBxAC&usg=AOvVaw16FEqTPMZm56l_Cvl5Heg5,False
Hong Kong crypto firm hit by $200 million hack,Reuters,2023-09-26,https://www.reuters.com/technology/hong-kong-crypto-firm-hit-by-200-million-hack-2023-09-25/&ved=2ahUKEwiaysTcuNqBAxWkmWoFHXsgBTk4-gEQxfQBegQICRAC&usg=AOvVaw1th99uB3kqQ32pMWgKe28X,False
"Hong Kong to tighten crypto regulation, Thailand to tax crypto overseas: Law Decoded",Cointelegraph,2023-09-26,https://cointelegraph.com/news/hong-kong-to-tighten-crypto-regulation-thailand-to-tax-crypto-overseas-law-decoded-sept-18-25&ved=2ahUKEwiaysTcuNqBAxWkmWoFHXsgBTk4-gEQxfQBegQIABAC&usg=AOvVaw0znpfqo6wJ-zVNs_m66jOZ,False
"Crypto sees outflows for 6th consecutive week, XRP and SOL gain investor confidence",Cointelegraph,2023-09-26,https://cointelegraph.com/news/crypto-sees-outflows-for-6th-consecutive-week-xrp-sol-gain-investor-confidence&ved=2ahUKEwiaysTcuNqBAxWkmWoFHXsgBTk4-gEQxfQBegQIAxAC&usg=AOvVaw04R1XVf7mXhmQIhUbHK8Jn,False
Hong Kong fraud probe tests city's pro-crypto stance,Financial Times,2023-09-26,https://www.ft.com/content/74a88386-189f-44f3-b173-a77c97b2943c&ved=2ahUKEwiaysTcuNqBAxWkmWoFHXsgBTk4-gEQxfQBegQIBhAC&usg=AOvVaw2-nfyq8xTwBKIbSZfPcY3O,False
Hackers steal $200M from crypto company Mixin,TechCrunch,2023-09-26,https://techcrunch.com/2023/09/25/hackers-steal-200-million-from-crypto-company-mixin/&ved=2ahUKEwiaysTcuNqBAxWkmWoFHXsgBTk4-gEQxfQBegQIARAC&usg=AOvVaw3Iiule0Ps-HTUiYVZgXhGg,False
"Shock Crypto Leak Reveals Microsoft Could Be About To Blow Up The Price Of Bitcoin, Ethereum, XRP And BNB",Forbes,2023-09-26,https://www.forbes.com/sites/digital-assets/2023/09/25/shock-crypto-xbox-leak-reveals-microsoft-could-be-about-to-blow-up-the-price-of-bitcoin-ethereum-xrp-and-bnb/&ved=2ahUKEwiaysTcuNqBAxWkmWoFHXsgBTk4-gEQxfQBegQIBBAC&usg=AOvVaw1D8saKqJgqRyUgnduSSdvQ,False
Panorama - Downfall of the Crypto King - Extended Version,BBC,2023-09-26,https://www.bbc.co.uk/iplayer/episode/p0gffn3y/panorama-downfall-of-the-crypto-king-extended-version&ved=2ahUKEwiaysTcuNqBAxWkmWoFHXsgBTk4-gEQxfQBegQICBAC&usg=AOvVaw26nfYAee-PNJWftDaWtAdo,False
Crypto king or conman: is Sam Bankman-Fried about to be sent down for a century?,The Guardian,2023-09-26,https://www.theguardian.com/business/2023/sep/25/crypto-king-or-conman-is-sam-bankman-fried-about-to-be-sent-down-for-a-century&ved=2ahUKEwiaysTcuNqBAxWkmWoFHXsgBTk4-gEQxfQBegQIBRAC&usg=AOvVaw3lwLL6Q81XjiLYoYlq7RKX,False
FTX: How the fall of the 'King of Crypto' cost one British man millions,BBC,2023-09-26,https://www.bbc.com/news/technology-66892685&ved=2ahUKEwiaysTcuNqBAxWkmWoFHXsgBTk4-gEQxfQBegQIAhAC&usg=AOvVaw1iP1ow2KGNd6_Hr5WZ33BV,False
Crypto traders shift focus to 4 altcoins as Bitcoin price flatlines,Cointelegraph,2023-09-26,https://cointelegraph.com/news/bitcoin-price-flat-altcoins-chainlink-maker-arbitrum-theta-network&ved=2ahUKEwijjODduNqBAxUIlmoFHYMjA0c4hAIQxfQBegQIABAC&usg=AOvVaw23zs2BPww5IeGz4ywp9aUI,False
Yield Farming: The Truth About This Crypto Investment Strategy,Investopedia,2023-09-26,https://www.investopedia.com/what-is-yield-farming-7098519&ved=2ahUKEwijjODduNqBAxUIlmoFHYMjA0c4hAIQxfQBegQICRAC&usg=AOvVaw287g0cDWRxFWfMrFSro3yq,False
Tokenizing real-world assets on blockchains is for crypto lovers as well as crypto skeptics now,CNBC,2023-09-26,https://www.cnbc.com/2023/09/23/tokenizing-real-world-assets-on-blockchains-is-for-crypto-lovers-as-well-as-crypto-skeptics-now.html&ved=2ahUKEwijjODduNqBAxUIlmoFHYMjA0c4hAIQxfQBegQIBhAC&usg=AOvVaw3FhjExe7JJIFYXkQUoBiPQ,False
JPEX: Hong Kong investigates influencer-backed crypto exchange,BBC,2023-09-26,https://www.bbc.com/news/world-asia-china-66874170&ved=2ahUKEwijjODduNqBAxUIlmoFHYMjA0c4hAIQxfQBegQIARAC&usg=AOvVaw05FaQJ0muNXN0hFdNSSqE7,False
A Complete Guide to Cryptocurrency,The Motley Fool,2023-09-26,https://www.fool.com/investing/stock-market/market-sectors/financials/cryptocurrency-stocks/guide-to-cryptocurrencies/&ved=2ahUKEwijjODduNqBAxUIlmoFHYMjA0c4hAIQxfQBegQIBBAC&usg=AOvVaw1Kvvc9bHpBa4Ww_5Aej4aE,False
"Vitalik Buterin, the man behind ethereum, talks crypto and the U.S. crackdown",CNBC,2023-09-26,https://www.cnbc.com/2023/09/22/vitalik-buterin-cnbc-interview-ethereum-founder-on-us-crypto-crackdown.html&ved=2ahUKEwijjODduNqBAxUIlmoFHYMjA0c4hAIQxfQBegQIAxAC&usg=AOvVaw1V96nb4gjwUugrdjEfCPdB,False
Your NFTs Are Actually — Finally — Totally Worthless,Rolling Stone,2023-09-19,https://www.rollingstone.com/culture/culture-news/nfts-worthless-researchers-find-1234828767/&ved=2ahUKEwijjODduNqBAxUIlmoFHYMjA0c4hAIQxfQBegQIBxAC&usg=AOvVaw2seXnRUZ8JKNOrLJqsutyx,False
13 Best Bitcoin Gambling Sites and Crypto Casinos High Rollers Choose,Times Union,2023-09-19,https://www.timesunion.com/marketplace/article/best-crypto-casinos-17622100.php&ved=2ahUKEwijjODduNqBAxUIlmoFHYMjA0c4hAIQxfQBegQIAhAC&usg=AOvVaw32yuian5RZ8ikKTXRXHjCx,False
FTX: 'King of Crypto' parents sued over missing millions,BBC,2023-09-19,https://www.bbc.com/news/business-66857146&ved=2ahUKEwijjODduNqBAxUIlmoFHYMjA0c4hAIQxfQBegQICBAC&usg=AOvVaw3j0tv2b-0UmP9XWXThsbw8,False
"SEC’s Crypto Enforcement Chief Warns More Charges Coming to Exchanges, DeFi",CoinDesk,2023-09-19,https://www.coindesk.com/policy/2023/09/19/us-secs-crypto-enforcement-chief-warns-more-charges-coming-to-exchanges-defi/&ved=2ahUKEwijjODduNqBAxUIlmoFHYMjA0c4hAIQxfQBegQIBRAC&usg=AOvVaw1GzaUsBKYnTmBofKeumAVr,False
FTX Tweaks Crypto Sale Proposal to Placate U.S. Government,CoinDesk,2023-09-12,https://www.coindesk.com/policy/2023/09/13/ftx-tweaks-crypto-sale-proposal-to-placate-us-government/&ved=2ahUKEwiogpbfuNqBAxWEnGoFHS9EBs04jgIQxfQBegQIARAC&usg=AOvVaw0EEVvYcCdbmdyd6MWaFNuS,False
SEC Chair Gensler calls out crypto’s ‘wide-ranging noncompliance’ in hearing: CNBC Crypto World,YouTube,2023-09-12,https://www.youtube.com/watch%3Fv%3DRF8N_-4dySw&ved=2ahUKEwiogpbfuNqBAxWEnGoFHS9EBs04jgIQxfQBegQICRAC&usg=AOvVaw2FfrUzlgu90a-sD9HbzE21,False
Binance.US CEO Leaves Embattled Crypto Exchange,The Wall Street Journal,2023-09-12,https://www.wsj.com/finance/currencies/binance-us-ceo-leaves-embattled-crypto-exchange-ac93f2b7&ved=2ahUKEwiogpbfuNqBAxWEnGoFHS9EBs04jgIQxfQBegQIAhAC&usg=AOvVaw2MTRqAeP5VMQ_zPszYZwrr,False
